{
  "artifacts": [
    {
      "path": "cargo-version.txt",
      "sha256": "fcfafeedf9e1047337cbc09d4b2279bbf73c68b0230dadfa2551a3122a92fe7c",
      "size": 336
    },
    {
      "path": "corpus-integrity.status.txt",
      "sha256": "9a271f2a916b0b6ee6cecb2426f0b3206ef074578be55d9bc94f6f3fe3ab86aa",
      "size": 2
    },
    {
      "path": "corpus-integrity.stderr",
      "sha256": "e3b0c44298fc1c149afbf4c8996fb92427ae41e4649b934ca495991b7852b855",
      "size": 0
    },
    {
      "path": "corpus-integrity.stdout",
      "sha256": "6470063aaa712a2cdcb60cee6d19d54468a8b52ce7cddd312538c2f97ef371cd",
      "size": 328
    },
    {
      "path": "default-dependencies.status.txt",
      "sha256": "9a271f2a916b0b6ee6cecb2426f0b3206ef074578be55d9bc94f6f3fe3ab86aa",
      "size": 2
    },
    {
      "path": "default-dependencies.stderr",
      "sha256": "e3b0c44298fc1c149afbf4c8996fb92427ae41e4649b934ca495991b7852b855",
      "size": 0
    },
    {
      "path": "default-dependencies.stdout",
      "sha256": "c724c37f4d974e98c6029ed8ff1ad8497caf0c3f21cc169be076233d1d1d59b5",
      "size": 1195
    },
    {
      "path": "diff-integrity.status.txt",
      "sha256": "9a271f2a916b0b6ee6cecb2426f0b3206ef074578be55d9bc94f6f3fe3ab86aa",
      "size": 2
    },
    {
      "path": "diff-integrity.stderr",
      "sha256": "e3b0c44298fc1c149afbf4c8996fb92427ae41e4649b934ca495991b7852b855",
      "size": 0
    },
    {
      "path": "diff-integrity.stdout",
      "sha256": "e3b0c44298fc1c149afbf4c8996fb92427ae41e4649b934ca495991b7852b855",
      "size": 0
    },
    {
      "path": "input-schema.status.txt",
      "sha256": "9a271f2a916b0b6ee6cecb2426f0b3206ef074578be55d9bc94f6f3fe3ab86aa",
      "size": 2
    },
    {
      "path": "input-schema.stderr",
      "sha256": "e3b0c44298fc1c149afbf4c8996fb92427ae41e4649b934ca495991b7852b855",
      "size": 0
    },
    {
      "path": "input-schema.stdout",
      "sha256": "aa1a41325f81a324a6e591e718bb614b014b2d2f5d15e34b2beed9515cb77e72",
      "size": 36
    },
    {
      "path": "jsonschema-version.txt",
      "sha256": "33bdaf9e2d6bcbde2e4e613e865e403f8fe21fc621078d34c30b0bdc7f68d903",
      "size": 6
    },
    {
      "path": "make-ci.status.txt",
      "sha256": "9a271f2a916b0b6ee6cecb2426f0b3206ef074578be55d9bc94f6f3fe3ab86aa",
      "size": 2
    },
    {
      "path": "make-ci.stderr",
      "sha256": "ebc2eba4e9fd6ae220e699c3904727c37f848bc441d91096135f75f77cf0c54b",
      "size": 6507
    },
    {
      "path": "make-ci.stdout",
      "sha256": "b4bc8c0b6c5f4b72d08502a7e144cfb120798f5d64a108003feb4d921cd60abf",
      "size": 4463
    },
    {
      "path": "make-spec.status.txt",
      "sha256": "9a271f2a916b0b6ee6cecb2426f0b3206ef074578be55d9bc94f6f3fe3ab86aa",
      "size": 2
    },
    {
      "path": "make-spec.stderr",
      "sha256": "c7f69e6a2c700f428cf93bcd2894433d8d6b5935e5e1564d6e2a1a5e8dfd1040",
      "size": 2544
    },
    {
      "path": "make-spec.stdout",
      "sha256": "3554c5051b53ff1246de12a6dfda011db57d2eae0d448105b8cb567424cfcc23",
      "size": 1281
    },
    {
      "path": "manifest-schema.status.txt",
      "sha256": "9a271f2a916b0b6ee6cecb2426f0b3206ef074578be55d9bc94f6f3fe3ab86aa",
      "size": 2
    },
    {
      "path": "manifest-schema.stderr",
      "sha256": "e3b0c44298fc1c149afbf4c8996fb92427ae41e4649b934ca495991b7852b855",
      "size": 0
    },
    {
      "path": "manifest-schema.stdout",
      "sha256": "aa1a41325f81a324a6e591e718bb614b014b2d2f5d15e34b2beed9515cb77e72",
      "size": 36
    },
    {
      "path": "metadata.json",
      "sha256": "b832fd14c51ae2d6126b0787cfc88d456a618f8b646447cc9a20f82baaa999e7",
      "size": 285421
    },
    {
      "path": "pgm01-schema.status.txt",
      "sha256": "9a271f2a916b0b6ee6cecb2426f0b3206ef074578be55d9bc94f6f3fe3ab86aa",
      "size": 2
    },
    {
      "path": "pgm01-schema.stderr",
      "sha256": "e3b0c44298fc1c149afbf4c8996fb92427ae41e4649b934ca495991b7852b855",
      "size": 0
    },
    {
      "path": "pgm01-schema.stdout",
      "sha256": "aa1a41325f81a324a6e591e718bb614b014b2d2f5d15e34b2beed9515cb77e72",
      "size": 36
    },
    {
      "path": "pgm01-validator.status.txt",
      "sha256": "9a271f2a916b0b6ee6cecb2426f0b3206ef074578be55d9bc94f6f3fe3ab86aa",
      "size": 2
    },
    {
      "path": "pgm01-validator.stderr",
      "sha256": "e3b0c44298fc1c149afbf4c8996fb92427ae41e4649b934ca495991b7852b855",
      "size": 0
    },
    {
      "path": "pgm01-validator.stdout",
      "sha256": "880e89f6fba06e110656ee8f493a587d1545807e27938463a3a35c5cb2817fb5",
      "size": 30
    },
    {
      "path": "python-version.txt",
      "sha256": "f6b75e07f1488db28a89724a522725e3e01af3dc78f6fd365f17eb4059e41056",
      "size": 15
    },
    {
      "path": "quire-coverage.status.txt",
      "sha256": "9a271f2a916b0b6ee6cecb2426f0b3206ef074578be55d9bc94f6f3fe3ab86aa",
      "size": 2
    },
    {
      "path": "quire-coverage.stderr",
      "sha256": "add8d41b382b7996e0430fa23a7c01e0342c0dbfe3d392ec82a2b8b5161abbe5",
      "size": 1855
    },
    {
      "path": "quire-coverage.stdout",
      "sha256": "a4b743ed665499bca098c9d7072c4f6da9d755e158b8daa5b7a4e628ba62f03f",
      "size": 1195
    },
    {
      "path": "quire-provenance.json",
      "sha256": "6df2f8c787012733dbcaab24f8810dd127a508513ba521a852592539c938ec91",
      "size": 664
    },
    {
      "path": "rustc-version.txt",
      "sha256": "a834181975ab3494d51a1a01e4a9d4321fecd674a52e3db3cf93b3b84b6fc2c1",
      "size": 196
    },
    {
      "path": "rustdoc.status.txt",
      "sha256": "9a271f2a916b0b6ee6cecb2426f0b3206ef074578be55d9bc94f6f3fe3ab86aa",
      "size": 2
    },
    {
      "path": "rustdoc.stderr",
      "sha256": "58726b79945d44e02952e087413521de9973392a6af7138830778829c2723e8d",
      "size": 195
    },
    {
      "path": "rustdoc.stdout",
      "sha256": "e3b0c44298fc1c149afbf4c8996fb92427ae41e4649b934ca495991b7852b855",
      "size": 0
    },
    {
      "path": "source-revision.txt",
      "sha256": "c09e08b0ac1a5533fc79ca0891ba48e3266f65f7fde23303c83ab906f2a5b7bd",
      "size": 41
    },
    {
      "path": "source-state.txt",
      "sha256": "2e22da2ab13713309ac75219e525b8e06ed02f3f1963b8feef203fa25827f93d",
      "size": 6
    }
  ],
  "collectedAt": "2026-08-31T05:10:32Z",
  "limitations": [
    "manual-dispatch remote CI is not part of this local envelope",
    "generated and fuzz populations are bounded evidence rather than proof over every bounded string",
    "the crate constructs syntax graphs but does not establish temporal semantic correctness",
    "independent human approval and the source-release decision remain pending",
    "the exact finalized envelope is validated externally and does not self-attest"
  ],
  "outcomes": [
    {
      "exitCode": 0,
      "name": "make-ci",
      "status": "passed"
    },
    {
      "exitCode": 0,
      "name": "make-spec",
      "status": "passed"
    },
    {
      "exitCode": 0,
      "name": "quire-coverage",
      "status": "passed"
    },
    {
      "exitCode": 0,
      "name": "rustdoc",
      "status": "passed"
    },
    {
      "exitCode": 0,
      "name": "default-dependencies",
      "status": "passed"
    },
    {
      "exitCode": 0,
      "name": "corpus-integrity",
      "status": "passed"
    },
    {
      "exitCode": 0,
      "name": "diff-integrity",
      "status": "passed"
    },
    {
      "exitCode": 0,
      "name": "input-schema",
      "status": "passed"
    },
    {
      "exitCode": 0,
      "name": "manifest-schema",
      "status": "passed"
    },
    {
      "exitCode": 0,
      "name": "pgm01-schema",
      "status": "passed"
    },
    {
      "exitCode": 0,
      "name": "pgm01-validator",
      "status": "passed"
    }
  ],
  "schemaVersion": "tl-parse.evidence-manifest/v1",
  "sourceRevision": "64b2b1e610fbf8681c65749cd8618cc1f6385cbb"
}
