{
  "artifacts": [
    {
      "path": "cargo-version.txt",
      "sha256": "fcfafeedf9e1047337cbc09d4b2279bbf73c68b0230dadfa2551a3122a92fe7c",
      "size": 336
    },
    {
      "path": "corpus-integrity.status.txt",
      "sha256": "9a271f2a916b0b6ee6cecb2426f0b3206ef074578be55d9bc94f6f3fe3ab86aa",
      "size": 2
    },
    {
      "path": "corpus-integrity.stderr",
      "sha256": "e3b0c44298fc1c149afbf4c8996fb92427ae41e4649b934ca495991b7852b855",
      "size": 0
    },
    {
      "path": "corpus-integrity.stdout",
      "sha256": "209505c0605451fc22845ba7d23e061db1db4b18e87a21a464f87accdaa5cdf2",
      "size": 352
    },
    {
      "path": "default-dependencies.status.txt",
      "sha256": "9a271f2a916b0b6ee6cecb2426f0b3206ef074578be55d9bc94f6f3fe3ab86aa",
      "size": 2
    },
    {
      "path": "default-dependencies.stderr",
      "sha256": "e3b0c44298fc1c149afbf4c8996fb92427ae41e4649b934ca495991b7852b855",
      "size": 0
    },
    {
      "path": "default-dependencies.stdout",
      "sha256": "c724c37f4d974e98c6029ed8ff1ad8497caf0c3f21cc169be076233d1d1d59b5",
      "size": 1195
    },
    {
      "path": "diff-integrity.status.txt",
      "sha256": "9a271f2a916b0b6ee6cecb2426f0b3206ef074578be55d9bc94f6f3fe3ab86aa",
      "size": 2
    },
    {
      "path": "diff-integrity.stderr",
      "sha256": "e3b0c44298fc1c149afbf4c8996fb92427ae41e4649b934ca495991b7852b855",
      "size": 0
    },
    {
      "path": "diff-integrity.stdout",
      "sha256": "e3b0c44298fc1c149afbf4c8996fb92427ae41e4649b934ca495991b7852b855",
      "size": 0
    },
    {
      "path": "input-schema.status.txt",
      "sha256": "9a271f2a916b0b6ee6cecb2426f0b3206ef074578be55d9bc94f6f3fe3ab86aa",
      "size": 2
    },
    {
      "path": "input-schema.stderr",
      "sha256": "e3b0c44298fc1c149afbf4c8996fb92427ae41e4649b934ca495991b7852b855",
      "size": 0
    },
    {
      "path": "input-schema.stdout",
      "sha256": "aa1a41325f81a324a6e591e718bb614b014b2d2f5d15e34b2beed9515cb77e72",
      "size": 36
    },
    {
      "path": "jsonschema-version.txt",
      "sha256": "33bdaf9e2d6bcbde2e4e613e865e403f8fe21fc621078d34c30b0bdc7f68d903",
      "size": 6
    },
    {
      "path": "make-ci.status.txt",
      "sha256": "53c234e5e8472b6ac51c1ae1cab3fe06fad053beb8ebfd8977b010655bfdd3c3",
      "size": 2
    },
    {
      "path": "make-ci.stderr",
      "sha256": "017ee448c93df81dae5dc02383eb3065661c174ab55526a9cd302ec57f5af4a5",
      "size": 8723
    },
    {
      "path": "make-ci.stdout",
      "sha256": "ed349a46b24073cd4eaf76df3c282a5cbaeb895edadf284acdc47f043acdb512",
      "size": 3628
    },
    {
      "path": "make-spec.status.txt",
      "sha256": "53c234e5e8472b6ac51c1ae1cab3fe06fad053beb8ebfd8977b010655bfdd3c3",
      "size": 2
    },
    {
      "path": "make-spec.stderr",
      "sha256": "b05fe1fd0d93b11c155ad2daebf86e95a6a659d6f2af6ffa2ffc5d926f77d918",
      "size": 1510
    },
    {
      "path": "make-spec.stdout",
      "sha256": "815775c6f6a40e69e3e5b526f56626b09f3c9d304f7496200100ee4485cc9540",
      "size": 99
    },
    {
      "path": "manifest-schema.status.txt",
      "sha256": "9a271f2a916b0b6ee6cecb2426f0b3206ef074578be55d9bc94f6f3fe3ab86aa",
      "size": 2
    },
    {
      "path": "manifest-schema.stderr",
      "sha256": "e3b0c44298fc1c149afbf4c8996fb92427ae41e4649b934ca495991b7852b855",
      "size": 0
    },
    {
      "path": "manifest-schema.stdout",
      "sha256": "aa1a41325f81a324a6e591e718bb614b014b2d2f5d15e34b2beed9515cb77e72",
      "size": 36
    },
    {
      "path": "metadata.json",
      "sha256": "b832fd14c51ae2d6126b0787cfc88d456a618f8b646447cc9a20f82baaa999e7",
      "size": 285421
    },
    {
      "path": "pgm01-schema.status.txt",
      "sha256": "9a271f2a916b0b6ee6cecb2426f0b3206ef074578be55d9bc94f6f3fe3ab86aa",
      "size": 2
    },
    {
      "path": "pgm01-schema.stderr",
      "sha256": "e3b0c44298fc1c149afbf4c8996fb92427ae41e4649b934ca495991b7852b855",
      "size": 0
    },
    {
      "path": "pgm01-schema.stdout",
      "sha256": "aa1a41325f81a324a6e591e718bb614b014b2d2f5d15e34b2beed9515cb77e72",
      "size": 36
    },
    {
      "path": "pgm01-validator.status.txt",
      "sha256": "9a271f2a916b0b6ee6cecb2426f0b3206ef074578be55d9bc94f6f3fe3ab86aa",
      "size": 2
    },
    {
      "path": "pgm01-validator.stderr",
      "sha256": "e3b0c44298fc1c149afbf4c8996fb92427ae41e4649b934ca495991b7852b855",
      "size": 0
    },
    {
      "path": "pgm01-validator.stdout",
      "sha256": "880e89f6fba06e110656ee8f493a587d1545807e27938463a3a35c5cb2817fb5",
      "size": 30
    },
    {
      "path": "python-version.txt",
      "sha256": "f6b75e07f1488db28a89724a522725e3e01af3dc78f6fd365f17eb4059e41056",
      "size": 15
    },
    {
      "path": "quire-coverage.status.txt",
      "sha256": "4355a46b19d348dc2f57c046f8ef63d4538ebb936000f3c9ee954a27460dd865",
      "size": 2
    },
    {
      "path": "quire-coverage.stderr",
      "sha256": "1740ca02f083d4a284d7eefb4899394abede45aae6730ff80a53a375816882e7",
      "size": 782
    },
    {
      "path": "quire-coverage.stdout",
      "sha256": "e3b0c44298fc1c149afbf4c8996fb92427ae41e4649b934ca495991b7852b855",
      "size": 0
    },
    {
      "path": "quire-provenance.json",
      "sha256": "6df2f8c787012733dbcaab24f8810dd127a508513ba521a852592539c938ec91",
      "size": 664
    },
    {
      "path": "rustc-version.txt",
      "sha256": "a834181975ab3494d51a1a01e4a9d4321fecd674a52e3db3cf93b3b84b6fc2c1",
      "size": 196
    },
    {
      "path": "rustdoc.status.txt",
      "sha256": "9a271f2a916b0b6ee6cecb2426f0b3206ef074578be55d9bc94f6f3fe3ab86aa",
      "size": 2
    },
    {
      "path": "rustdoc.stderr",
      "sha256": "6d10b11d0087c3c31d89131de20511c35c732966524f43e8745d099366ccbcfb",
      "size": 195
    },
    {
      "path": "rustdoc.stdout",
      "sha256": "e3b0c44298fc1c149afbf4c8996fb92427ae41e4649b934ca495991b7852b855",
      "size": 0
    },
    {
      "path": "source-revision.txt",
      "sha256": "11f103cea930f0d905c4cfb2cbc1f73042be4519375ce660c27ec7528e993455",
      "size": 41
    },
    {
      "path": "source-state.txt",
      "sha256": "2e22da2ab13713309ac75219e525b8e06ed02f3f1963b8feef203fa25827f93d",
      "size": 6
    }
  ],
  "collectedAt": "2026-08-31T16:26:43Z",
  "limitations": [
    "manual-dispatch remote CI is not part of this local envelope",
    "generated and fuzz populations are bounded evidence rather than proof over every bounded string",
    "the crate constructs syntax graphs but does not establish temporal semantic correctness",
    "independent human approval and the source-release decision remain pending",
    "one or more locally collected commands failed",
    "the exact finalized envelope is validated externally and does not self-attest"
  ],
  "outcomes": [
    {
      "exitCode": 2,
      "name": "make-ci",
      "status": "failed"
    },
    {
      "exitCode": 2,
      "name": "make-spec",
      "status": "failed"
    },
    {
      "exitCode": 1,
      "name": "quire-coverage",
      "status": "failed"
    },
    {
      "exitCode": 0,
      "name": "rustdoc",
      "status": "passed"
    },
    {
      "exitCode": 0,
      "name": "default-dependencies",
      "status": "passed"
    },
    {
      "exitCode": 0,
      "name": "corpus-integrity",
      "status": "passed"
    },
    {
      "exitCode": 0,
      "name": "diff-integrity",
      "status": "passed"
    },
    {
      "exitCode": 0,
      "name": "input-schema",
      "status": "passed"
    },
    {
      "exitCode": 0,
      "name": "manifest-schema",
      "status": "passed"
    },
    {
      "exitCode": 0,
      "name": "pgm01-schema",
      "status": "passed"
    },
    {
      "exitCode": 0,
      "name": "pgm01-validator",
      "status": "passed"
    }
  ],
  "schemaVersion": "tl-parse.evidence-manifest/v1",
  "sourceRevision": "f58ed6473841d87b6faf713b7c9abd3852a4e6ef"
}
